序号,标题,发文日期,效力状态,内容,主题
654,河北省人民政府办公厅关于落实《河北省政府信息公开规定》有关问题的通知, 2009-06-15,有效,,综合政务
655,河北省人民政府办公厅关于同意肃临线衡水至衡邢界段公路项目建成后设置收费站收取机动车辆通行费的复函, 2009-06-15,有效,,工业、交通
656,河北省人民政府办公厅关于同意张尚线公路项目建成后设置收费站收取机动车辆通行费的复函, 2009-06-15,有效,,工业、交通
657,河北省人民政府办公厅关于同意建立海兴湿地和鸟类省级自然保护区的函, 2009-06-15,有效,,城乡建设、环境保护
658,河北省人民政府办公厅关于同意定魏线石家庄段公路项目建成后设置收费站收取机动车辆通行费的复函, 2009-06-15,有效,,工业、交通
659,河北省人民政府办公厅关于印发河北省职工安全生产知识电视培训活动方案的通知, 2009-06-15,有效,,市场监管、安全生产监管
660,河北省人民政府办公厅印发关于贯彻落实全省信息化与信息产业工作部署分工意见的通知, 2009-06-15,有效,,其他
661,河北省人民政府办公厅关于印发《石家庄铁路分局在冀普通中小学和医院移交属地实施方案》的通知, 2009-06-15,有效,,其他
662,河北省人民政府办公厅河北省人事厅关于评选表彰全省政府办公室（厅）系统督查工作先进集体和先进工作者、先进个人的通知, 2009-06-15,有效,,其他
663,河北省人民政府办公厅关于印发《全省钢铁工业生产运行座谈会议纪要》的通知, 2009-06-15,有效,,其他
664,河北省人民政府办公厅关于评选全国再就业工作先进集体和个人的通知, 2009-06-15,有效,,其他
665,河北省人民政府办公厅关于建立河北省城市化工作联席会议制度的通知, 2009-06-15,有效,,其他
666,河北省人民政府办公厅关于成立河北省整顿和规范矿产资源开发秩序领导小组的通知, 2009-06-15,有效,,组织机构
667,河北省人民政府办公厅关于同意郑昔线枣强至衡邢界段公路项目建成后设置收费站收取机动车辆通行费的复函, 2009-06-15,有效,,工业、交通
668,河北省人民政府办公厅关于迁西县贷款建设东南环及滦河特大桥工程收取机动车辆通行费的复函, 2009-06-15,有效,,工业、交通
669,河北省人民政府办公厅关于建立国家和省教育统一考试工作部门联席会议制度的通知, 2009-06-15,有效,,其他
670,河北省人民政府办公厅关于印发《河北省深化煤矿安全生产专项整治实施方案》的通知, 2009-06-15,有效,,市场监管、安全生产监管
671,河北省人民政府办公厅关于同意建立唐海湿地和鸟类自然保护区的复函, 2009-06-15,有效,,城乡建设、环境保护
672,河北省人民政府办公厅关于同意隆昔线隆尧至獐么段公路项目建成后设置收费站收取机动车辆通行费的复函, 2009-06-15,有效,,工业、交通
673,河北省人民政府办公厅关于成立河北省推广应用税控收款机工作领导小组的通知, 2009-06-15,有效,,其他
674,河北省人民政府办公厅关于成立河北省省以下国土资源管理体制改革和干部管理体制调整工作领导小组及办公室的通知, 2009-06-15,有效,,[]
675,河北省人民政府办公厅关于印发河北省突发公共事件应急预案制定和修订工作方案的通知, 2009-06-15,有效,,其他
676,河北省人民政府办公厅关于同意平泉至铁门关段公路项目建成后设置收费站收取机动车辆通行费的复函, 2009-06-15,有效,,工业、交通
677,河北省人民政府办公厅关于建立河北省就业工作联席会议制度的通知, 2009-06-15,有效,,其他
678,河北省人民政府办公厅关于同意京建线承德市段公路项目建成后设置收费站收取机动车辆通行费的复函, 2009-06-15,有效,,工业、交通
679,河北省人民政府办公厅关于同意设立怀安公路动物防疫监督临时检查站点的复函, 2009-06-15,有效,,其他
680,河北省人民政府办公厅关于同意肃临线邢台市段公路项目建成后设置收费站收取机动车辆通行费的复函, 2009-06-15,有效,,工业、交通
681,河北省人民政府办公厅关于调整河北省煤矿安全生产整顿验收工作领导小组成员的通知, 2009-06-15,有效,,其他
682,河北省人民政府办公厅关于同意洋新线洋河南至柴沟堡段公路项目建成后设置收费站收取机动车辆通行费的复函, 2009-06-15,有效,,工业、交通
683,河北省人民政府办公厅关于调整河北省防治重大动物疫病指挥部成员的通知, 2009-06-15,有效,,其他
684,河北省人民政府办公厅关于同意邢临高速公路建成后设置收费站收取机动车辆通行费的复函, 2009-06-15,有效,,公路
685,河北省人民政府办公厅关于做好今冬明春安全生产工作的通知, 2009-06-15,有效,,市场监管、安全生产监管
686,河北省人民政府办公厅关于成立河北省产品质量电子监管网推广应用领导小组的通知, 2009-06-15,有效,,其他
687,河北省人民政府办公厅关于印发《河北省“清查放射源让百姓放心”专项行动方案》的通知, 2009-06-15,有效,,城乡建设、环境保护
688,河北省人民政府办公厅转发关于省属国有企业主辅分离辅业改制有关政策意见的通知, 2009-06-15,有效,,国民经济管理、国有资产监管
689,河北省人民政府办公厅关于成立河北省农业产业化工作领导小组的通知, 2009-06-15,有效,,[]
690,河北省人民政府办公厅关于同意将河北滦河上游省级自然保护区更名为河北木兰围场省级自然保护区的复函, 2009-06-15,有效,,其他
691,河北省人民政府办公厅关于全省公共卫生项目建设情况的通报, 2009-06-15,有效,,卫生、体育
692,河北省人民政府办公厅关于对全省清理建设领域拖欠工程款工作督查的通知, 2009-06-15,有效,,其他
693,河北省人民政府办公厅关于印发《河北省道路交通秩序整顿方案》的通知, 2009-06-15,有效,,工业、交通
694,河北省人民政府办公厅关于同意１１２线丰宁至陈栅子段公路项目建成后设置收费站收取机动车辆通行费的复函, 2009-06-15,有效,,工业、交通
695,河北省人民政府办公厅关于同意廊涞线固安至娄村段公路项目建成后设置收费站收取机动车辆通行费的复函, 2009-06-15,有效,,工业、交通
