序号,标题,发文日期,效力状态,内容,主题
五、重点工程项目“十二五”期间，我省将实施水污染减排、大气污染减排、固体废物污染减排、生态环境保护、环境保护能力建设与环境管理等五大类重点环境保护工程，投资需求约1250亿元。充分利用市场机制，形成多元化的投入格局，确保工程投资到位。工程投入以企业和地方各级政府为主，积极争取中央资金支持。定期开展工程项目绩效评价，提高投资效益。六、规划实施（一）加强组织领导，落实环保目标责任制。各级政府是实施规划的责任主体，要把规划的目标、任务、措施和重点工程纳入本地国民经济和社会发展总体规划，切实履行责任，确保规划全面实施。各有关部门要依法做好各自领域的环境保护工作，将规划要求落实到各行业规划，重点行业要单独编制行业环境保护规划，确保相关任务的落实。继续实施环境保护目标考核责任制，将污染物总量控制、环境质量改善、环境风险防范、重点流域水污染防治、集中式饮用水水源地保护及环境保护能力建设等纳入目标责任制考核范围，严格检查，认真兑现奖惩措施。（二）完善环境管理体系，健全综合决策机制。进一步完善“党委领导、政府负责、人大监督、环保部门统一监管、各有关部门分工负责、社会公众积极参与”的环境保护工作机制。在经济社会发展中，充分发挥环境保护参与综合决策的作用，全面建立规划环境影响评价体系，特别是在土地开发利用、区域流域海域开发利用、重要产业发展和城市建设等方面严格实施规划环境影响评价，并作为有关建设项目环评审批的前置条件，合理确定区域发展规模、产业结构和布局，从决策源头防止环境污染和生态破坏。强化各行业环境保护职责。环境保护部门要加强环境保护的指导、协调、监督和综合管理。发展改革、财政等部门要制定有利于环境保护的财税、产业、价格和投资等政策，加大环境保护的投入力度。科技部门要加强对脱硝、重金属污染防治关键技术研发支持。国土资源部门要控制生态用地开发，加强矿产资源开发的环境治理恢复，防止地下水过度开采和污染，保障环境保护重点工程建设用地。住房和城乡建设部门要统筹城乡开展污水、垃圾收集处理设施建设。交通运输部门要加强公路、铁路、港口、航道建设与运输中的生态环境保护，全面提升污染事故应急处置能力。工业行业要进一步加大产业结构调整力度，完善落后产能退出机制，加强工业污染防治。水利行业要优化水资源利用和调配，统筹保障生活、生产经营和生态环境用水，强化水土流失治理。农业要科学施用化肥、农药，减少流失和环境污染，加强畜禽养殖污染防治、农业节水、农业物种资源和草地生态保护，加强外来物种管理。商贸流通行业要严格宾馆、饭店的污染控制，积极开展绿色贸易。卫生行业要积极推进环境与健康相关工作，加大重金属诊疗系统建设力度。林业要加强林业生态建设力度。旅游行业要合理开发旅游资源，加强旅游区的环境保护。能源行业要合理调控能源消费总量，大力实施能源结构战略调整，显著提高清洁能源比重。加强近岸海域和海洋生态系统保护，加快海洋自然保护区建设。（三）加强环保法制建设，加大环境执法监察和督查力度。加快《白洋淀水污染防治条例》、《河北省机动车排气污染防治办法》和《河北省陆上石油勘探开发环境保护管理办法》制定步伐。适时制定衡水湖水污染防治条例、河北省自然保护区条例，城市尘污染防治管理办法、建筑施工噪声防治、固体废物环境污染防治、土壤重金属污染防治、持久性有机污染物（POPs）污染防治、畜禽养殖污染防治等地方性法规，为推进区域环境质量改善提供法制保障。全面落实《河北省主要污染物排放权交易管理办法（试行）》，扩展主要污染物总量控制管理手段。探索建立操作性强的农村环境保护法律法规，推动地方性生态补偿条例制定工作。完善环境标准。紧紧围绕全省经济结构战略性调整，在冶金、建材、石油化工、医药造纸等重污染行业继续深化环境保护准入制度，建立完善《河北省钢铁行业污染物排放标准》等环境标准，从排放源头上严格污染物排放量。全面推进企业清洁生产强制审核，有效促进污染防治由末端治理控制向全过程控制延伸。适时开展应急状态下环境质量标准制定工作，积极开展环境风险评估，研究编制医药、焦化行业环境风险等级划分技术指南。强化环保执法，探索执法方式改革。严厉查处环境违法行为，加大现场监督检查力度，挂牌督办重点违法案件，对污染危害严重，群众反映强烈的企业，落实限期治理制度。严格审批新建项目，实行建设项目审批“总量指标”与“容量许可”双重控制，认真执行建设项目分级审批的规定。严肃追究环境监管失职责任，建立环保后督察制度，完善环保违法案件移送制度，落实环境违法违纪责任追究制度。（四）建立多元投融资机制，加大环保资金投入。各级政府要加强规划实施的保障性财政预算，不断提高环境保护在政府财政预算中的比例，加大污染防治、生态保护等环保领域投资力度，确保环境保护投入增加比例不低于经济增长水平。深化“以奖促防”、“以奖促治”、“以奖代补”等资金支持机制，强化财政资金的引导作用，增加环境保护专项资金规模。进一步加强农村环境综合整治投入，加大农业面源和畜禽养殖污染治理财政扶持力度。加大“211环境保护”预算科目经费支持力度，大幅度提高环保机构经费保障水平。强化环境保护专项资金使用监督管理，加强资金使用绩效评价和项目后续管理，努力提高财政性环保资金的投资绩效。推进污染治理市场化进程，拓宽融资渠道，鼓励污水处理、垃圾处理等环保基础设施建设采取多种融资形式，实现投资主体多元化、运营主体企业化、运行管理市场化。积极寻求和推进环保国际合作，努力争取国际援助项目和贷款项目。进一步完善环境经济政策，逐步形成反映资源环境成本的价格机制。提高排污收费标准，完善污水处理和垃圾处置等收费制度。推行环境污染责任保险制度，制定出台《关于在重污染行业开展环境污染责任保险试点的实施意见》。深化绿色信贷制度建设，研究制定《河北省绿色信贷指导目录》，抑制重污染项目，鼓励清洁生产项目。（五）鼓励环境科技创新，促进环保产业发展。制定优惠政策鼓励环保科技创新，特别是在水污染、大气污染、土壤污染、噪声污染、固体废物、农业面源污染以及生态保护、资源循环利用、饮用水安全等领域组织建立环保科研技术团队，加强环境保护共性和关键技术的研发，加快高新技术在环保领域的应用。培育环保技术转化市场，促进环保科技成果转化。深化环境保护重大战略、政策、标准、管理体系及专项科研课题研究，发挥环境科技对环境管理的支撑作用。加快推进环保产业发展。严格市场准入制度，规范环保产业市场，完善招投标机制，抑制不正当竞争。扶持和培育环保龙头企业，走规模化、集约化、集团化发展的路子。大力发展环保服务业，推进环境咨询市场化，完善相关的职（执）业资格制度。充分发挥行业协会等中介组织的作用，逐步完善多功能全方位的环保产业政策、市场、技术、信息咨询服务网络体系。（六）加大宣传教育力度，推进公众参与。以“蓝天碧水燕赵行”专题宣传教育活动为平台，围绕全省环境保护工作，每年推出主题鲜明、内容丰富的专题报道活动。以“六·五”世界环境日为契机，开展针对性强、内容丰富的环保宣传活动。拓展“绿色创建”内容，深化创建形式，创建示范单位。深入开展“环境保护‘十百千’宣传教育工程试点活动”，积极倡导建设生态文明的理念。以省环境保护联合会为桥梁和纽带，积极引导并充分发挥各类环保组织在环境宣传教育公益事业中的作用。完善环保公众监督和参与机制。加强政府、企业环境信息公开，加强公众对环境违法行为和环保执法工作监督，通过环保热线、网络、新闻媒体广开举报渠道，保证广大人民群众依法行使检举权和控告权。完善公众举报案件的快速查处机制，继续坚持环境污染举报奖励制度，80001激励公众积极参与对环境违法行为的监督活动。强化公众环保听证制度，保障公众的环境知情权、参与权和监督权。（七）强化规划检查、评估和考核，确保任务目标落实。建立规划检查、评估和考核机制。各级政府要高度重视规划的实施，定期检查调度规划进展情况，分析存在的问题，并建立通报制度。到2013年底前，组织对规划进行中期评估，对规划任务进展缓慢的地区预警并实行挂牌督办。到2015年底前，对规划完成情况实施终期考核。评估和考核结果向社会公布，并作为各级政府及领导干部的政绩考核内容，作为干部任免奖惩的重要依据。

",城乡建设、环境保护
426,河北省人民政府办公厅关于唐山市滦县东出口滦河大桥及北戴河国际机场连接线工程项目收取机动车辆通行费的复函, 2012-01-13,有效,,城乡建设、环境保护
427,河北省人民政府办公厅关于同意永年县广府古城等景区为省级风景名胜区的复函, 2012-01-04,有效,,城乡建设、环境保护
428,河北省人民政府办公厅关于印发河北省村民一事一议筹资筹劳管理办法的通知, 2011-12-31,有效,,农业、林业、水利
429,河北省人民政府办公厅关于进一步推进全省生活垃圾处理工作的实施意见, 2011-12-31,有效,,城乡建设、环境保护
430,河北省人民政府办公厅关于印发河北省食品工业“十二五”规划的通知, 2011-12-29,有效,,工业、交通
431,河北省人民政府办公厅关于同意迁安市滦县乐亭县为河北省生态园林城市（县城）的复函, 2011-12-23,有效,,城乡建设、环境保护
432,河北省人民政府办公厅关于同意衡水市等20个市县（市）为省级园林城市（县城）的复函, 2011-12-15,有效,,城乡建设、环境保护
433,河北省人民政府办公厅关于同意密涿支线高速公路诸葛店至段甲岭段设置收费站的复函, 2011-12-12,有效,,工业、交通
434,河北省人民政府办公厅转发省工业和信息化厅等部门关于促进融资性担保行业规范发展实施意见的通知, 2011-12-12,有效,,国民经济管理、国有资产监管
435,河北省人民政府办公厅关于唐山市古冶区外环路收费项目增加一收费站的复函, 2011-12-12,有效,,工业、交通
436,河北省人民政府办公厅关于依法保护工会资产加强工会办公和职工活动场所建设的通知, 2011-11-28,有效,,其他
437,河北省人民政府办公厅关于印发河北省城镇保障性安居工程“十二五”规划的通知, 2011-11-25,有效,"各设区市人民政府，各县（市、区）人民政府，省政府各部门：《河北省城镇保障性安居工程“十二五”规划》已经省政府同意，现印发给你们，请结合本地本部门实际认真组织实施。二〇一一年十一月二十三日为落实党中央、国务院加快推进保障性安居工程的决策部署，适应我省经济社会发展“调结构、促发展、惠民生”的客观需要，加强房地产市场调控，扩大保障性安居工程建设规模，特别是着力解决中、低收入家庭住房困难问题，保障和改善民生，实现住有所居，根据国家和省国民经济和社会发展“十二五”规划纲要，结合我省推进新型城镇化的新要求，制定《河北省城镇保障性安居工程“十二五”规划（2011—2015年）》。（一）成就回顾。1.综合经济实力跨上新台阶。2010年全省国内生产总值达到20197亿元，三次产业比重为12.7∶53∶34.3,社会经济发展由工业化中期向后期阶段转变。全部财政收入2410.5亿元，地方一般财政收入1330.8亿元。城镇居民人均可支配收入由2006年的9107元提高到2010年的16190元，农民人均纯收入由2006年的3482元提高到2010年的5510元，城乡居民储蓄存款余额达到15678.4亿元、增长1.2倍，5年城镇新增就业265.8万人。2.住房保障取得阶段性成绩。经过多年努力，我省城市低收入住房困难家庭的住房问题得到有效解决；城市中低收入住房困难家庭的住房问题也已纳入政府工作计划，针对城市中低收入住房困难家庭的公共租赁住房和限价商品住房建设正式起步。到2010年底，全省城镇家庭户数为940万户，全省保障性住房和各类棚户区改造达到98.6万户（保障性住房65.83万户、棚户区改造32.78万户），住房保障覆盖率为10.49%。“十一五”期间全省保障性住房和各类棚户区改造达到56万户（保障性住房30.1万户、棚户区改造25.9万户），其中保障性住房中廉租住房9.3万套，经济适用住房20.4万套，公共租赁住房2457套，限价商品住房800套。各类棚户区改造中城市棚户区改造23万户，国有工矿棚户区、林场危旧房改造0.85万户。















各设区市人民政府，各县（市、区）人民政府，省政府各部门：《河北省城镇保障性安居工程“十二五”规划》已经省政府同意，现印发给你们，请结合本地本部门实际认真组织实施。二〇一一年十一月二十三日为落实党中央、国务院加快推进保障性安居工程的决策部署，适应我省经济社会发展“调结构、促发展、惠民生”的客观需要，加强房地产市场调控，扩大保障性安居工程建设规模，特别是着力解决中、低收入家庭住房困难问题，保障和改善民生，实现住有所居，根据国家和省国民经济和社会发展“十二五”规划纲要，结合我省推进新型城镇化的新要求，制定《河北省城镇保障性安居工程“十二五”规划（2011—2015年）》。（一）成就回顾。1.综合经济实力跨上新台阶。2010年全省国内生产总值达到20197亿元，三次产业比重为12.7∶53∶34.3,社会经济发展由工业化中期向后期阶段转变。全部财政收入2410.5亿元，地方一般财政收入1330.8亿元。城镇居民人均可支配收入由2006年的9107元提高到2010年的16190元，农民人均纯收入由2006年的3482元提高到2010年的5510元，城乡居民储蓄存款余额达到15678.4亿元、增长1.2倍，5年城镇新增就业265.8万人。2.住房保障取得阶段性成绩。经过多年努力，我省城市低收入住房困难家庭的住房问题得到有效解决；城市中低收入住房困难家庭的住房问题也已纳入政府工作计划，针对城市中低收入住房困难家庭的公共租赁住房和限价商品住房建设正式起步。到2010年底，全省城镇家庭户数为940万户，全省保障性住房和各类棚户区改造达到98.6万户（保障性住房65.83万户、棚户区改造32.78万户），住房保障覆盖率为10.49%。“十一五”期间全省保障性住房和各类棚户区改造达到56万户（保障性住房30.1万户、棚户区改造25.9万户），其中保障性住房中廉租住房9.3万套，经济适用住房20.4万套，公共租赁住房2457套，限价商品住房800套。各类棚户区改造中城市棚户区改造23万户，国有工矿棚户区、林场危旧房改造0.85万户。















",城乡建设、环境保护
438,河北省人民政府办公厅关于印发河北省综合交通体系建设“十二五”规划的通知, 2011-11-25,有效,,工业、交通
439,河北省人民政府办公厅关于印发河北省城镇化发展“十二五”规划的通知, 2011-11-25,有效,　　　　　　　　　　,城乡建设、环境保护
440,河北省人民政府办公厅关于同意荣乌高速公路徐水至涞源（冀晋界）段一期工程设置收费站的复函, 2011-11-10,有效,,工业、交通
441,河北省人民政府办公厅关于同意唐山市滨海大道海港开发区至曹妃甸段设置收费站的复函, 2011-11-10,有效,,工业、交通
442,河北省人民政府办公厅关于印发河北省消防工作“十二五”规划的通知, 2011-11-09,有效,,公安、安全、司法
